{
  "$schema": "https://json-schema.org/draft/2020-12/schema",
  "description": "Synthetic commercial insurance policy packet record. Records are heterogeneous and may represent locations, coverages, forms, endorsements, exclusions, rating rows, or premium items depending on record_type.",
  "properties": {
    "annual_payroll": {"type": "string"},
    "building_number": {"type": "string"},
    "business_income_basis": {"type": "string"},
    "class_code": {"type": "string"},
    "classification": {"type": "string"},
    "coinsurance": {"type": "string"},
    "coverage": {"type": "string"},
    "coverage_part": {"type": "string"},
    "deductible": {"type": "string"},
    "edition_date": {"type": "string"},
    "endorsement_effective_date": {"type": "string"},
    "endorsement_number": {"type": "string"},
    "estimated_premium": {"type": "string"},
    "exclusion_name": {"type": "string"},
    "experience_mod": {"type": "string"},
    "exposure": {"type": "string"},
    "exposure_basis": {"type": "string"},
    "form_number": {"type": "string"},
    "form_title": {"type": "string"},
    "governing_class": {"type": "string"},
    "item_id": {"type": "string"},
    "limit": {"type": "string"},
    "limit_type": {"type": "string"},
    "lob": {"type": "string"},
    "location_number": {"type": "string"},
    "manual_rate": {"type": "string"},
    "materiality": {"type": "string"},
    "named_insured": {"type": "string"},
    "policy_number": {"type": "string"},
    "policy_period": {"type": "string"},
    "premises_address": {"type": "string"},
    "premium": {"type": "string"},
    "premium_basis": {"type": "string"},
    "products_completed_ops_rate": {"type": "string"},
    "rate": {"type": "string"},
    "record_type": {"type": "string"},
    "schedule_credit_debit": {"type": "string"},
    "schedule_source": {"type": "string"},
    "state": {"type": "string"},
    "territory": {"type": "string"},
    "valuation": {"type": "string"}
  },
  "required": ["lob", "policy_number", "named_insured", "policy_period", "record_type"],
  "title": "PolicyPacketItem",
  "type": "object"
}
