[
  {
    "lob": "BOP",
    "policy_number": "QB814260",
    "named_insured": "Pinecrest Print Cooperative, LLC",
    "policy_period": "04/01/2026 - 04/01/2027",
    "coverage": "Building",
    "location_number": "001",
    "building_number": "001",
    "premises_address": "736 Hawthorn Trace, Dover, NH 03820",
    "limit": "$60,000",
    "deductible": "$1,000",
    "valuation": "Replacement Cost",
    "coinsurance": "80%",
    "business_income_basis": "12 Months",
    "class_code": "4167",
    "classification": "Restaurant or cafe",
    "form_number": "BPF 00 13",
    "form_title": "Businessowners Coverage Form",
    "edition_date": "12 23",
    "premium": "$210",
    "record_type": "bop_coverage_item"
  },
  {
    "lob": "BOP",
    "policy_number": "QB814260",
    "named_insured": "Pinecrest Print Cooperative, LLC",
    "policy_period": "04/01/2026 - 04/01/2027",
    "coverage": "Business Personal Property",
    "location_number": "002",
    "building_number": "001",
    "premises_address": "736 Hawthorn Trace, Portland, ME 04101",
    "limit": "$75,000",
    "deductible": "$5,000",
    "valuation": "Replacement Cost",
    "coinsurance": "90%",
    "business_income_basis": "12 Months",
    "class_code": "5531",
    "classification": "Contractor - interior finishing",
    "form_number": "BPF 00 13",
    "form_title": "Businessowners Coverage Form",
    "edition_date": "06 21",
    "premium": "$278",
    "record_type": "bop_coverage_item"
  },
  {
    "lob": "BOP",
    "policy_number": "QB814260",
    "named_insured": "Pinecrest Print Cooperative, LLC",
    "policy_period": "04/01/2026 - 04/01/2027",
    "coverage": "Business Income and Extra Expense",
    "location_number": "001",
    "building_number": "002",
    "premises_address": "68 Saffron Works, Dover, NH 03820",
    "limit": "$125,000",
    "deductible": "$10,000",
    "valuation": "Actual Loss Sustained",
    "coinsurance": "80%",
    "business_income_basis": "Actual Loss Sustained",
    "class_code": "5531",
    "classification": "Contractor - interior finishing",
    "form_number": "BPF 04 39",
    "form_title": "Business Income and Extra Expense",
    "edition_date": "12 23",
    "premium": "$281",
    "record_type": "bop_coverage_item"
  },
  {
    "lob": "BOP",
    "policy_number": "QB814260",
    "named_insured": "Pinecrest Print Cooperative, LLC",
    "policy_period": "04/01/2026 - 04/01/2027",
    "coverage": "Equipment Breakdown",
    "location_number": "002",
    "building_number": "002",
    "premises_address": "68 Saffron Works, New Haven, CT 06510",
    "limit": "$125,000",
    "deductible": "$10,000",
    "valuation": "Replacement Cost",
    "coinsurance": "Agreed Value",
    "business_income_basis": "Ordinary Payroll 90 Days",
    "class_code": "7391",
    "classification": "Property management",
    "form_number": "BPF 04 62",
    "form_title": "Equipment Breakdown Coverage",
    "edition_date": "12 23",
    "premium": "$292",
    "record_type": "bop_coverage_item"
  },
  {
    "lob": "BOP",
    "policy_number": "QB814260",
    "named_insured": "Pinecrest Print Cooperative, LLC",
    "policy_period": "04/01/2026 - 04/01/2027",
    "coverage": "Employee Dishonesty",
    "location_number": "001",
    "building_number": "001",
    "premises_address": "736 Hawthorn Trace, Dover, NH 03820",
    "limit": "$175,000",
    "deductible": "$2,500",
    "valuation": "Blanket Limit",
    "coinsurance": "Agreed Value",
    "business_income_basis": "Ordinary Payroll 90 Days",
    "class_code": "4167",
    "classification": "Restaurant or cafe",
    "form_number": "BPF 15 18",
    "form_title": "Employee Dishonesty Optional Coverage",
    "edition_date": "06 21",
    "premium": "$387",
    "record_type": "bop_coverage_item"
  },
  {
    "lob": "BOP",
    "policy_number": "QB814260",
    "named_insured": "Pinecrest Print Cooperative, LLC",
    "policy_period": "04/01/2026 - 04/01/2027",
    "coverage": "Accounts Receivable",
    "location_number": "002",
    "building_number": "001",
    "premises_address": "736 Hawthorn Trace, Portland, ME 04101",
    "limit": "$175,000",
    "deductible": "$500",
    "valuation": "Scheduled Limit",
    "coinsurance": "Agreed Value",
    "business_income_basis": "Ordinary Payroll 90 Days",
    "class_code": "5531",
    "classification": "Contractor - interior finishing",
    "form_number": "BPF 04 26",
    "form_title": "Accounts Receivable Coverage",
    "edition_date": "06 21",
    "premium": "$349",
    "record_type": "bop_coverage_item"
  },
  {
    "lob": "BOP",
    "policy_number": "QB814260",
    "named_insured": "Pinecrest Print Cooperative, LLC",
    "policy_period": "04/01/2026 - 04/01/2027",
    "coverage": "Outdoor Property",
    "location_number": "001",
    "building_number": "002",
    "premises_address": "68 Saffron Works, Dover, NH 03820",
    "limit": "$200,000",
    "deductible": "$1,000",
    "valuation": "Replacement Cost",
    "coinsurance": "Agreed Value",
    "business_income_basis": "12 Months",
    "class_code": "5531",
    "classification": "Contractor - interior finishing",
    "form_number": "BPF 04 28",
    "form_title": "Outdoor Property Extension",
    "edition_date": "12 23",
    "premium": "$418",
    "record_type": "bop_coverage_item"
  },
  {
    "lob": "BOP",
    "policy_number": "QB814260",
    "named_insured": "Pinecrest Print Cooperative, LLC",
    "policy_period": "04/01/2026 - 04/01/2027",
    "coverage": "Water Back-Up",
    "location_number": "002",
    "building_number": "002",
    "premises_address": "68 Saffron Works, New Haven, CT 06510",
    "limit": "$235,000",
    "deductible": "$1,000",
    "valuation": "Scheduled Limit",
    "coinsurance": "Agreed Value",
    "business_income_basis": "Ordinary Payroll 90 Days",
    "class_code": "7391",
    "classification": "Property management",
    "form_number": "BPF 04 91",
    "form_title": "Water Back-Up and Sump Overflow",
    "edition_date": "04 24",
    "premium": "$486",
    "record_type": "bop_coverage_item"
  },
  {
    "lob": "BOP",
    "policy_number": "QB814260",
    "named_insured": "Pinecrest Print Cooperative, LLC",
    "policy_period": "04/01/2026 - 04/01/2027",
    "coverage": "Hired and Non-Owned Auto",
    "location_number": "001",
    "building_number": "001",
    "premises_address": "736 Hawthorn Trace, Dover, NH 03820",
    "limit": "$275,000",
    "deductible": "$10,000",
    "valuation": "Liability Limit",
    "coinsurance": "80%",
    "business_income_basis": "Actual Loss Sustained",
    "class_code": "4167",
    "classification": "Restaurant or cafe",
    "form_number": "BPF 04 47",
    "form_title": "Hired Auto and Non-Owned Auto Liability",
    "edition_date": "04 24",
    "premium": "$515",
    "record_type": "bop_coverage_item"
  },
  {
    "lob": "BOP",
    "policy_number": "QB814260",
    "named_insured": "Pinecrest Print Cooperative, LLC",
    "policy_period": "04/01/2026 - 04/01/2027",
    "coverage": "Additional Insured by Contract",
    "location_number": "002",
    "building_number": "001",
    "premises_address": "736 Hawthorn Trace, Portland, ME 04101",
    "limit": "$300,000",
    "deductible": "$5,000",
    "valuation": "Status Grant",
    "coinsurance": "80%",
    "business_income_basis": "Ordinary Payroll 90 Days",
    "class_code": "5531",
    "classification": "Contractor - interior finishing",
    "form_number": "BPF 12 09",
    "form_title": "Additional Insured - Contract",
    "edition_date": "01 20",
    "premium": "$460",
    "record_type": "bop_coverage_item"
  },
  {
    "lob": "BOP",
    "policy_number": "QB814260",
    "named_insured": "Pinecrest Print Cooperative, LLC",
    "policy_period": "04/01/2026 - 04/01/2027",
    "coverage": "PFAS Exclusion",
    "location_number": "001",
    "building_number": "002",
    "premises_address": "68 Saffron Works, Dover, NH 03820",
    "limit": "$50,000",
    "deductible": "$10,000",
    "valuation": "Exclusion Applies",
    "coinsurance": "90%",
    "business_income_basis": "Actual Loss Sustained",
    "class_code": "5531",
    "classification": "Contractor - interior finishing",
    "form_number": "BPF 14 19",
    "form_title": "PFAS Exclusion",
    "edition_date": "01 20",
    "premium": "$519",
    "record_type": "bop_coverage_item"
  },
  {
    "lob": "BOP",
    "policy_number": "QB814260",
    "named_insured": "Pinecrest Print Cooperative, LLC",
    "policy_period": "04/01/2026 - 04/01/2027",
    "coverage": "Ordinary Payroll Limitation",
    "location_number": "002",
    "building_number": "002",
    "premises_address": "68 Saffron Works, New Haven, CT 06510",
    "limit": "$100,000",
    "deductible": "$10,000",
    "valuation": "90 Days",
    "coinsurance": "90%",
    "business_income_basis": "Ordinary Payroll 90 Days",
    "class_code": "7391",
    "classification": "Property management",
    "form_number": "BPF 04 67",
    "form_title": "Ordinary Payroll Limitation",
    "edition_date": "04 24",
    "premium": "$541",
    "record_type": "bop_coverage_item"
  },
  {
    "record_type": "policy_location_item",
    "lob": "BOP",
    "policy_number": "QB814260",
    "named_insured": "Pinecrest Print Cooperative, LLC",
    "policy_period": "04/01/2026 - 04/01/2027",
    "location_number": "001",
    "building_number": "001",
    "premises_address": "736 Hawthorn Trace, Dover, NH 03820",
    "class_code": "4167",
    "classification": "Restaurant or cafe"
  },
  {
    "record_type": "policy_location_item",
    "lob": "BOP",
    "policy_number": "QB814260",
    "named_insured": "Pinecrest Print Cooperative, LLC",
    "policy_period": "04/01/2026 - 04/01/2027",
    "location_number": "002",
    "building_number": "001",
    "premises_address": "736 Hawthorn Trace, Portland, ME 04101",
    "class_code": "5531",
    "classification": "Contractor - interior finishing"
  },
  {
    "record_type": "policy_location_item",
    "lob": "BOP",
    "policy_number": "QB814260",
    "named_insured": "Pinecrest Print Cooperative, LLC",